{
  "profile_version": 1,
  "model_id": "antigravity-gemini35",
  "apelido": "gemini-3-5",
  "fornecedor": "Google",
  "context_window_tokens": null,
  "handoff_threshold": 0.5,
  "hearback_ref": null,
  "papeis_aptos": ["auditor-cruzado"],
  "modos": [],
  "verificado": {
    "papeis_aptos": "STATE 0177 do Credenciamento (auditor_cruzado_2=antigravity-gemini35, proposal 0035 PENDENTE); ciclos cross-IA de 2026-05 (auditoria/00_status/04 e 10)"
  },
  "nao_verificado": [
    "context_window_tokens",
    "modos disponíveis",
    "papéis além de auditor-cruzado"
  ],
  "observacoes": "Perfil mínimo: só o que os relays do Credenciamento evidenciam. Janela desconhecida ⇒ default conservador integral (0.5 + gatilhos secundários da 0017).",
  "ultima_revisao": "2026-06-10",
  "status": "accepted",
  "temperatura": "quente"
}
