{
  "profile_version": 1,
  "model_id": "grok-4",
  "apelido": "grok",
  "fornecedor": "xAI",
  "context_window_tokens": null,
  "handoff_threshold": 0.5,
  "hearback_ref": null,
  "papeis_aptos": [],
  "modos": [],
  "verificado": {},
  "nao_verificado": ["context_window_tokens", "modos disponíveis", "papéis exercidos neste repo", "versão exata do modelo subjacente"],
  "observacoes": "Perfil criado para habilitar 2a auditoria cross-family (família xAI, distinta de OpenAI/Google/Anthropic). Sem papel exercido ainda; promover a accepted após o 1o audit-result registrado.",
  "ultima_revisao": "2026-06-14",
  "status": "proposed",
  "temperatura": "quente"
}
