{
  "profile_version": 1,
  "model_id": "claude-fable-5",
  "apelido": "fable-5",
  "fornecedor": "Anthropic",
  "context_window_tokens": 1000000,
  "handoff_threshold": 0.5,
  "hearback_ref": null,
  "papeis_aptos": ["auditor-arquiteto"],
  "modos": ["chat-desktop", "agentic-tools"],
  "verificado": {
    "context_window_tokens": "env da sessão de 2026-06-10: 'claude-fable-5[1m]' (correntes C1–C7 do canônico)",
    "papeis_aptos": "correntes C1–C7 exercidas como arquiteto do protocolo (REGISTRY 20260610-01..27)",
    "modos": "esta sessão roda em desktop com ferramentas agênticas (Read/Write/bash)"
  },
  "nao_verificado": [
    "modos: cli (não exercido neste protocolo)",
    "papeis: implementador/consolidador (nunca exercidos sob este protocolo)",
    "limites de output por turno"
  ],
  "observacoes": "Janela 1M: o default 0.5 (500K tokens) é deliberadamente conservador. Relaxamento para 0.7 será proposto SOMENTE após a 0017 paramétrica ser adotada e com hearback explícito (o schema exige hearback_ref para >0.5). Gatilhos secundários da 0017 (turnos >30, sinais subjetivos de degradação) permanecem ativos independentemente do threshold.",
  "ultima_revisao": "2026-06-10",
  "status": "proposed",
  "temperatura": "quente"
}
